,sentence,difficulty
713,"- Je ne puis pas le savoir, dit le géographe'

- Ah !",B1
714,(Le petit prince était déçu.),A2
715,Et des montagnes ?,A1
716,"- Je ne puis pas le savoir, dit le géographe.",A2
717,- Et des villes et des fleuves et des déserts ?,B1
718,"- Je ne puis pas le savoir non plus, dit le géographe.",A2
719,- Mais vous êtes géographe !,A2
720,"- C'est exact, dit le géographe, mais je ne suis pas explorateur.",B1
721,Je manque absolument d'explorateurs.,B2
722,"Ce n'est pas le géographe qui va faire le compte des villes, des fleuves, des montagnes, des mers, des océans et des déserts.",B1
723,Le géographe est trop important pour flâner.,B2
724,Il ne quitte pas son bureau.,A2
725,Mais il y reçoit les explorateurs.,B1
726,"Il les interroge, et il prend en note leurs souvenirs.",B1
727,"Et si les souvenirs de l'un d'entre eux lui paraissent intéressants, le géographe fait faire une enquête sur la moralité de l'explorateur.",C1
728,- Pourquoi ça ?,A2
729,- Parce qu'un explorateur qui mentirait entraînerait des catastrophes dans les livres de géographie.,B2
730,Et aussi un explorateur qui boirait trop.,B1
731,- Pourquoi ça ?,A2
732,fit le petit prince.,A2
733,- Parce que les ivrognes voient double.,B2
734,Alors le géographe noterait deux montagnes là où il n'y en a qu'une seule.,B1
735,"- Je connais quelqu'un, dit le petit prince, qui serait mauvais explorateur.",B1
736,- C'est possible.,A2
737,"Donc, quand la moralité de l'explorateur paraît bonne, on fait une enquête sur sa découverte.",B1
738,- On va voir ?,A1
739,- Non.,A1
740,C'est trop compliqué.,A1
741,Mais on exige de l'explorateur qu'il fournisse des preuves.,B1
742,"S'il s'agit par exemple de la découverte d'une grosse montagne, on exige qu'il en rapporte de grosses pierres.",B1
743,Le géographe soudain s'émut.,C2
744,"- Mais toi, tu viens de loin !",A2
745,Tu es explorateur !,A1
746,Tu vas me décrire ta planète !,A2
747,"Et le géographe, ayant ouvert son registre, tailla son crayon.",C1
748,On note d'abord au crayon les récits des explorateurs.,C1
749,"On attend, pour noter à l'encre, que l'explorateur ait fournie des preuves.",B2
750,- Alors ?,A2
751,Interrogea le géographe.,B2
752,- Oh !,A2
753,"Chez moi, dit le petit prince, ce n'est pas très intéressant, c'est tout petit.",A2
754,J'ai trois volcans.,A1
755,"Deux volcans en activité, et un volcan éteint.",B2
756,Mais on ne sait jamais.,A2
757,"- On ne sait jamais, dit le géographe.",B1
758,- J'ai aussi une fleur.,A1
759,"- Nous ne notons pas les fleurs, dit le géographe.",B1
760,- Pourquoi ça !,A2
761,C'est le plus joli !,A1
762,- Parce que les fleurs sont éphémères.,B1
763,"- Qu'est-ce que signifie""éphémère""?",B1
764,"- Les géographies, dit le géographe, sont les livres les plus précieux de tous les livres.",B2
765,Elles ne se démodent jamais.,B2
766,Il est très rare qu'une montagne change de place.,A2
767,Il est très rare qu'un océan se vide de son eau.,A2
768,Nous écrivons des choses éternelles.,B2
769,"- Mais les volcans éteints peuvent se réveiller, interrompit le petit prince.",B2
770,"Qu'est-ce que signifie""éphémère""?",B2
771,"- Que les volcans soient éteints ou soient éveillés, ça revient au même pour nous autres, dit le géographe.",B2
772,"Ce qui compte pour nous, c'est la montagne.",A2
773,Elle ne change pas.,A2
774,"- Mais qu'est-ce que signifie""éphémère""?",B1
775,"répéta le petit prince qui, de sa vie, n'avait renoncé à une question, une fois qu'il l'avait posée.",B1
776,"- Ça signifie""qui est menacé de disparition prochaine"".",B1
777,- Ma fleur est menacée de disparition prochaine ?,B1
778,- Bien sûr.,A2
779,"""Ma fleur est éphémère, se dit le petit prince, et elle n'a que quatre épines pour se défendre contre le monde !",B1
780,"Et je l'ai laissée toute seule chez moi !""",A2
781,Ce fut là son premier mouvement de regret.,B2
782,"Mais il reprit courage :

Que me conseillez-vous d'aller visiter ?",B1
783,"demanda-

La planète Terre, lui répondit le géographe.",B2
784,Elle a une bonne réputation...,B1
785,"Et le petit prince s'en fut, songeant à sa fleur.",A2
786,La Terre n'est pas une planète quelconque !,A2
787,"On y compte cent onze rois (en n'oubliant pas, bien sûr, les rois nègres), sept mille géographes, neuf cent mille businessman, sept millions et demi d'ivrognes, trois cent onze millions de vaniteux, c'est-à-dire environ deux milliards de grandes personnes.",C1
788,"Pour vous donner une idée des dimensions de la Terre je vous dirai qu'avant l'invention de l'électricité on y devait entretenir, sur l'ensemble des six continents, une véritable armée de quatre cent soixante-deux mille cinq cent onze allumeurs de réverbères.",C1
789,Vu d'un peu loin ça faisait un effet splendide.,A2
790,Les mouvements de cette armée étaient réglés comme ceux d'un ballet d'opéra.,B2
791,D'abord venait le tour des allumeurs de réverbères de Nouvelle-Zélande et d'Australie.,B2
792,"Puis ceux-ci, ayant allumé leurs lampions, s'en allaient dormir.",B2
793,Alors entraient à leur tour dans la danse les allumeurs de réverbères de Chine et de Sibérie.,C1
794,Puis eux aussi s'escamotaient dans les coulisses.,B2
795,Alors venait le tour des allumeurs de réverbères de Russie et des Indes.,B2
796,Puis de ceux d'Afrique et d'Europe.,B1
797,Puis de ceux d'Amérique du Sud.,B1
798,Puis de ceux d'Amérique du Nord.,B1
799,Et jamais ils ne se trompaient dans leur ordre d'entrée en scène.,B2
800,C'était grandiose.,A2
801,"Seuls, l'allumeur de l'unique réverbère du pôle Nord, et son confrère de l'unique réverbère du pôle Sud, menaient des vies d'oisiveté et de nonchalance : ils travaillaient deux fois par an.",C2
802,Je n'ai pas été très honnête en vous parlant des allumeurs de réverbères.,B1
803,Je risque de donner une fausse idée de notre planète à ceux qui ne la connaissent pas.,A2
804,Les hommes occupent très peu de place sur la terre.,A2
805,"Si les deux milliards d'habitants qui peuplent la terre se tenaient debout et un peu serrés, comme pour un meeting, ils logeraient aisément sur une place publique de vingt milles de long sur vingt milles de large.",B2
806,On pourrait entasser l'humanité sur le moindre petit îlot du Pacifique.,B2
807,"Les grandes personnes, bien sûr, ne vous croiront pas.",A2
808,Elles s'imaginent tenir beaucoup de place.,B1
809,Elles se voient importantes comme des baobabs.,B2
810,Vous leur conseillerez donc de faire le calcul.,B1
811,Elles adorent les chiffres : ça leur plaira.,A2
812,Mais ne perdez pas votre temps à ce pensum.,A2
813,C'est inutile.,A1
814,Vous avez confiance en moi.,A2
815,"Le petit prince, une fois sur terre, fut donc bien surpris de ne voir personne.",A2
816,"Il avait déjà peur de s'être trompé de planète, quand un anneau couleur de lune remua dans le sable.",B1
817,"- Bonne nuit, fit le petit prince à tout hasard.",A2
818,"- Bonne nuit, fit le serpent.",A2
819,- Sur quelle planète suis-je tombé ?,A2
820,demanda le petit prince.,A2
821,"- Sur la Terre, en Afrique, répondit le serpent.",B1
822,- Ah !,A1
823,... Il n'y a donc personne sur la Terre ?,A2
824,- Ici c'est le désert.,A2
825,Il n'y a personne dans les déserts.,A2
826,"La Terre est grande, dit le serpent.",A1
827,"Le petit prince s'assit sur une pierre et leva les yeux vers le ciel :

- Je me demande, dit-il, si les étoiles sont éclairées afin que chacun puisse un jour retrouver la sienne.",B1
828,Regarde ma planète.,A1
829,Elle est juste au-dessus de nous... Mais comme elle est loin !,A2
830,"- Elle est belle, dit le serpent.",A2
831,Que viens-tu faire ici ?,A2
832,"- J'ai des difficultés avec une fleur, dit le petit prince.",A2
833,- Ah !,A1
834,fit le serpent.,A1
835,Et ils se turent.,A2
836,- Où sont les hommes ?,A2
837,reprit enfin le petit prince.,B2
838,"On est un peu seul dans le désert...

- On est seul aussi chez les hommes, dit le serpent.",A2
839,"Le petit prince le regarda longtemps :

- Tu es une drôle de bête, lui dit-il enfin, mince comme un doigt...

- Mais je suis plus puissant que le doigt d'un roi, dit le serpent.",A2
840,"Le petit prince eut un sourire

- Tu n'es pas bien puissant... tu n'as même pas de Pattes... tu ne Peux même pas voyager.",B1
841,"- Je puis t'emporter plus loin qu'un navire, dit le serpent.",A2
842,"Il s'enroula autour de la cheville du petit prince, comme un bracelet d'or :

- Celui que je touche, je le rends à la terre dont il est sorti, dit-il encore.",B1
843,Mais tu es pur et tu viens d'une étoile...,A2
844,Le petit prince ne répondit rien.,A2
845,"- Tu me fais pitié, toi si faible, sur cette Terre de granit.",B1
846,Je puis t'aider un jour si tu regrettes trop ta planète.,B1
847,"Je puis ...

- Oh !",A1
848,"J'ai très bien compris, fit le petit prince, mais pourquoi parles-tu toujours par énigmes ?",B1
849,"- Je les résous toutes, dit le serpent.",A2
850,Et ils se turent.,A2
851,"Une fleur à trois pétales, une fleur de rien du tout...

- Bonjour, dit le prince.",A2
852,"- Bonjour, dit la fleur.",A1
853,- Où sont les hommes ?,A2
854,demanda poliment le petit prince.,B2
855,"La fleur, un jour, avait vu passer une caravane

- Les hommes ?",B1
856,"Il en existe, je crois, six ou sept. Je les ai aperçus il y a des années.",A2
857,Mais on ne sait jamais où les trouver.,A2
858,Le vent les promène.,B1
859,"Ils manquent de racines, ça les gêne beaucoup.",B1
860,"- Adieu, fit le petit prince.",A2
861,"- Adieu, dit la fleur.",A2
862,Les seules montagnes qu'il eût jamais connues étaient les trois volcans qui lui arrivaient au genou.,C1
863,Et il se servait du volcan éteint comme d'un tabouret.,B1
864,"""D'une montagne haute comme celle-ci, se dit-il donc, j'apercevrai d'un coup toute la planète et tous les hommes...""Mais il n'aperçut rien que des aiguilles de roc bien aiguisées.",B1
865,"- Bonjour, dit-il à tout hasard.",A2
866,- Bonjour... bonjour... bonjour... répondit l'écho.,B2
867,- Qui êtes-vous ?,A2
868,dit le petit prince.,A2
869,- Qui êtes-vous... qui êtes-vous... qui êtes-vous... répondit l'écho.,B1
870,"- Soyez mes amis, je suis seul, dit-il.",A2
871,- Je suis seul ... je suis seul... je suis seul ... répondit l'écho.,C1
872,"""Quelle drôle de planète !",B1
873,pensa-t-il alors.,B2
874,"Elle est toute sèche, et toute pointue et toute salée.",B1
875,Et les hommes manquent d'imagination.,B1
876,Et les routes vont toutes chez les hommes.,A2
877,"- Bonjour, dit-il.",A2
878,C'était un jardin fleuri de roses.,A2
879,"- Bonjour, dirent les roses.",B1
880,Le petit prince les regarda.,A2
881,Elles ressemblaient toutes à sa fleur.,B2
882,- Qui êtes-vous ?,A2
883,"Leur demanda-t-il, stupéfait.",B2
884,"- Nous sommes des roses, dirent les roses.",A2
885,- Ah !,A1
886,fit le petit prince...,A2
887,Et il se sentit très malheureux.,B1
888,Sa fleur lui avait raconté qu'elle était seule de son espèce dans l'univers.,B1
889,"Et voici qu'il en était cinq mille, toutes semblables, dans un seul jardin !",B1
890,"""Elle serait bien vexée, se dit-il, si elle voyait ça... elle tousserait énormément et ferait semblant de mourir pour échapper au ridicule.",B1
891,"Et je serais bien obligé de faire semblant de la soigner, car, sinon, pour m'humilier moi aussi, elle se laisserait vraiment mourir...""

Puis il se dit encore :""Je me croyais riche d'une fleur unique, et je ne possède qu'une rose ordinaire.",B1
892,"Ça et mes trois volcans qui m'arrivent au genou, et dont l'un, peut-être, est éteint pour toujours, ça ne fait pas de moi un bien grand prince ...""Et, couché dans l'herbe, il pleura.",B1
893,"- Bonjour, dit le renard.",A1
894,"- Bonjour, répondit poliment le petit prince, qui se retourna mais ne vit rien.",B1
895,"- Je suis là, dit la voix, sous le pommier...

- Qui es-tu ?",A2
896,dit le Petit prince.,A2
897,"Tu es bien joli...

- Je suis un renard, dit le renard.",A2
898,"- Viens jouer avec moi, lui proposa le petit prince.",A2
899,"Je suis tellement triste...

- Je ne puis pas jouer avec toi, dit le renard.",A2
900,Je ne suis pas apprivoisé.,A2
901,- Ah !,A1
902,"Pardon, fit le petit prince.",A2
903,"Mais, après réflexion, il ajouta :

- Qu'est-ce que signifie""apprivoiser""?",B2
904,"- Tu n'es pas d'ici, dit le renard, que cherches-tu ?",A2
905,"- Je cherche les hommes, dit le petit prince.",A2
906,"Qu'est ce que signifie""apprivoiser""?",B1
907,"- Les hommes, dit le renard, ils ont des fusils et ils chassent.",A2
908,C'est bien gênant !,A2
909,Ils élèvent aussi des poules.,A1
910,C'est leur seul intérêt.,B1
911,Tu cherches des poules ?,A1
912,"- Non, dit le petit prince.",A2
913,Je cherche des amis.,A1
914,"Qu'est-ce que signifie""apprivoiser""?",B2
915,"- C'eft une chose trop oubliée, dit le renard.",B1
916,"Ça signifie""créer des liens...""

- Créer des liens ?",B1
917,"- Bien sûr, dit le renard.",A2
918,Tu n'es encore pour moi qu'un petit garçon tout semblable à cent mille petits garçons.,B1
919,Et je n'ai pas besoin de toi.,A2
920,Et tu n'as pas besoin de moi non plus.,A2
921,Je ne suis pour toi qu'un renard semblable à cent raille renards.,B1
922,"Mais, si tu m'apprivoises, nous aurons besoin l'un de l'autre.",B1
923,Tu seras pour moi unique au monde.,A2
924,"je serai pour toi unique au monde...

- je commence à comprendre, dit le petit prince.",A2
925,"Il y a une fleur... je crois qu'elle m'a apprivoisé...

- C'est possible, dit le renard.",A2
926,"On voit sur la Terre toutes sortes de choses...

- Oh !",A2
927,"ce n'est pas sur la Terre, dit le petit prince.",A2
928,"Le renard parut très intrigué

- Sur une autre planète ?",B2
929,- Oui.,A1
930,"- Il y a des chasseurs, sur cette planète-là ?",A2
931,- Non.,A1
932,"- ça, c'est intéressant !",A2
933,Et des poules ?,A1
934,- Non.,A1
935,"- Rien n'est parfait, soupira le renard.",B1
936,"Mais le renard revint à son idée :

- Ma vie est monotone.",B1
937,"Je chasse les poules, les hommes me chassent.",A1
938,"Toutes les poules se ressemblent, et tous les hommes se ressemblent.",A2
939,Je m'ennuie donc un peu.,A2
940,"Mais, si tu m'apprivoises, ma vie sera comme ensoleillée.",B1
941,Je connaîtrai un bruit de pas qui sera différent de tous les autres.,B1
942,Les autres pas me font rentrer sous terre.,A2
943,"Le tien m'appellera hors du terrier, comme une musique.",B1
944,Et puis regarde !,A2
945,"Tu vois, là-bas, les champs de blé ?",A1
946,Je ne mange pas de pain.,A1
947,Le blé pour moi est inutile.,A2
948,Les champs de blé ne me rappellent rien.,A2
949,"Et ça, c'est triste !",A2
950,Mais tu as des cheveux couleur d'or.,A1
951,Alors ce sera merveilleux quand tu m'auras apprivoisé !,B1
952,"Le blé, qui est doré, me fera souvenir de toi.",B1
953,Et j'aimerai le bruit du vent dans le blé...,A2
954,"Le renard se tut et regarda longtemps le petit prince :

- S'il te plaît... apprivoise-moi !",A2
955,dit-il.,A2
956,"- Je veux bien, répondit le petit prince, mais je n'ai pas beaucoup de temps.",A2
957,J'ai des amis à découvrir et beaucoup de choses à connaître.,A2
958,"- On ne connaît que les choses que l'on apprivoise, dit le renard.",B1
959,Les hommes n'ont plus le temps de rien connaître.,A2
960,Ils achètent des choses toutes faites chez les marchands.,A2
961,"Mais comme il n'existe point de marchands d'amis, les hommes n'ont plus d'amis.",B1
962,"Si tu veux un ami, apprivoise-moi !",A2
963,- Que faut-il faire ?,A2
964,dit le petit prince.,A2
965,"- Il faut être très patient, répondit le renard.",A2
966,"Tu t'assoiras d'abord un peu loin de moi, comme ça, dans l'herbe.",A1
967,Je te regarderai du coin de l'oeil et tu ne diras rien.,A2
968,Le langage est source de malentendus.,B2
969,"Mais, chaque jour, tu pourras t'asseoir un peu plus près...",A2
970,Le lendemain revint le petit prince.,A2
971,"- Il eût mieux valu revenir à la même heure, dit le renard.",B1
972,"Si tu viens, par exemple, à quatre heures de l'après-midi, dès trois heures je commencerai d'être heureux.",A2
973,"Plus l'heure avancera, plus je me sentirai heureux.",A2
974,"À quatre heures, déjà, je m'agiterai et m'inquiéterai; je découvrirai le prix du bonheur !",B1
975,"Mais si tu viens n'importe quand, je ne saurai jamais à quelle heure m'habiller le coeur... Il faut des rites.",B1
976,- Qu'est-ce qu'un rite ?,A1
977,dit le petit prince.,A2
978,"- C'est aussi quelque chose de trop oublié, dit le renard.",B1
979,"C'est ce qui fait qu'un jour est différent des autres jours, une heure, des autres heures.",A2
980,"Il y a un rite, par exemple, chez mes chasseurs.",B1
981,Ils dansent le jeudi avec les filles du village.,A1
982,Alors le jeudi est jour merveilleux !,A1
983,Je vais me promener jusqu'à la vigne.,A2
984,"Si les chasseurs dansaient n'importe quand, les jours se ressembleraient tous, et je n'aurais point de vacances.",B1
985,Ainsi le petit prince apprivoisa le renard.,B1
986,"Et quand l'heure du départ fut proche :

- Ah !",B1
987,dit le renard... Je pleurerai.,A2
988,"- C'est ta faute, dit le petit prince, je ne te souhaitais point de mal, mais tu as voulu que je t'apprivoise...

Bien sûr, dit le renard.",A2
989,- Mais tu vas pleurer !,A2
990,dit le petit prince.,A2
991,"- Bien sûr, dit le renard.",A2
992,- Alors tu n'y gagnes rien !,A2
993,"- J'y gagne, dit le renard, à cause de la couleur du blé.",A2
994,"Puis il ajouta :

- Va revoir les roses.",B1
995,Tu comprendras que la tienne est unique au monde.,A2
996,"Tu reviendras me dire adieu, et je te ferai cadeau d'un secret.",A2
997,Le petit prince s'en fut revoir les roses.,A2
998,"- Vous n'êtes pas du tout semblables à ma rose, vous n'êtes rien encore, leur dit-il.",A2
999,Personne ne vous a apprivoisées et vous n'avez apprivoisé personne.,A2
1000,Vous êtes comme était mon renard.,A2
1001,Ce n'était qu'un renard semblable à cent mille autres.,B1
1002,"Mais j'en ai fait mon ami, et il est maintenant unique au monde.",A2
1003,Et les roses étaient gênées.,B1
1004,"- Vous êtes belles, mais vous êtes vides, leur dit-il encore.",B1
1005,On ne peut pas mourir pour vous.,A2
1006,"Bien sûr, ma rose à moi, un passant ordinaire croirait qu'elle vous ressemble.",A2
1007,"Mais à elle seule elle est plus importante que vous toutes, puisque c'est elle que j'ai arrosée.",A2
1008,Puisque c'est elle que j'ai mise sous globe.,A2
1009,Puisque c'est elle que j'ai abritée par le paravent.,B1
1010,Puisque c'est elle dont j'ai tué les chenilles (sauf les deux ou trois pour les papillons).,B1
1011,"Puisque c'est elle que j'ai écoutée se plaindre, ou se vanter, ou même quelquefois se taire.",B1
1012,Puisque c'est ma rose.,A2
1013,"Et il revint vers le renard

- Adieu, dit-il...

- Adieu, dit le renard.",A2
1014,Voici mon secret.,A1
1015,Il est très simple : on ne voit bien qu'avec le coeur.,A2
1016,L'essentiel est invisible pour les yeux.,B1
1017,"- L'essentiel est invisible pour les yeux, répéta le petit prince, afin de se souvenir.",B1
1018,- C'est le temps que tu as perdu pour ta rose qui fait ta rose si importante.,A2
1019,"- C'est le temps que j'ai perdu pour ma rose... fit le petit prince, afin de se souvenir.",A2
1020,"- Les hommes ont oublié cette vérité, dit le renard.",A2
1021,Mais tu ne dois pas l'oublier.,A2
1022,Tu deviens responsable pour toujours de ce que tu as apprivoisé.,B1
1023,"Tu es responsable de ta rose ...

- Je suis responsable de ma rose ... répéta le petit prince, afin de se souvenir.",B1
1024,"- Bonjour, dit l'aiguilleur.",A2
1025,- Que fais-tu ici ?,A2
1026,dit le petit prince.,A2
1027,"- Je trie les voyageurs, par paquets de mille, dit l'aiguilleur.",B2
1028,"J'expédie les trains qui les emportent, tantôt vers la droite, tantôt vers la gauche.",B2
1029,"Et un rapide illuminé, grondant comme le tonnerre, fit trembler la cabine d'aiguillage.",C1
1030,"- Ils sont bien pressés, dit le petit prince.",A2
1031,Que cherchent-ils ?,A2
1032,"- L'homme de la locomotive l'ignore lui-même, dit l'aiguilleur.",B1
1033,"Et gronda, en sens inverse, un second rapide illuminé.",C1
1034,- Ils reviennent déjà ?,A2
1035,"demanda le petit prince...

- Ce ne sont pas les mêmes, dit l'aiguilleur.",A2
1036,C'est un échange.,A2
1037,"- Ils n'étaient pas contents, là où ils étaient ?",A2
1038,"- On n'est jamais content là où l'on est, dit l'aiguilleur.",A2
1039,Et gronda le tonnerre d'un troisième rapide illuminé.,C1
1040,- Ils poursuivent les premiers voyageurs ?,B2
1041,demanda le petit prince.,A2
1042,"- Ils ne poursuivent rien du tout, dit l'aiguilleur.",A2
1043,"Ils dorment là dedans, ou bien ils bâillent.",A2
1044,Les enfants seuls écrasent leur nez contre les vitres.,B1
1045,"- Les enfants seuls savent ce qu'ils cherchent, fit le petit prince.",A2
1046,"Ils perdent du temps pour une poupée de chiffons, et elle devient très importante, et si on la leur enlève, ils pleurent...

- Ils ont de la chance, dit l'aiguilleur.",A2
1047,"- Bonjour, dit le marchand.",A1
1048,C'était un marchand de pilules perfectionnées qui apaisent la soi£ On en avale une par semaine et l'on n'éprouve plus le besoin de boire.,B2
1049,- Pourquoi vends-tu ça ?,A2
1050,dit le petit prince.,A2
1051,"- C'est une grosse économie de temps, dit le marchand.",B1
1052,Les experts ont fait des calculs.,A2
1053,On épargne cinquante-trois minutes par semaine.,B2
1054,- Et que fait-on de ces cinquante-trois minutes ?,A2
1055,- Ah !,A1
1056,"Dis-je au petit prince, ils sont bien jolis, tes souvenirs, mais je n'ai pas encore réparé mon avion, je n'ai plus rien à boire, et je serais heureux, moi aussi, si je pouvais marcher tout doucement vers une fontaine

- Mon ami le renard, me dit-il...

- Mon petit bonhomme, il ne s'agit plus du renard 1

- Pourquoi ?",B1
1057,"- Parce qu'on va mourir de soif...

Il ne comprit pas mon raisonnement, il me répondit :

- C'est bien d'avoir eu un ami, même si l'on va mourir.",A2
1058,"Moi, je suis bien content d'avoir eu un ami renard...

""Il ne mesure pas le danger, me dis-je.",A2
1059,Il n'a jamais ni faim ni soif.,A2
1060,"Un peu de soleil lui suffit...""

Mais il me regarda et répondit à ma pensée

- J'ai soif aussi... cherchons un puits...

J'eus un geste de lassitude : il est absurde de chercher un puits, au hasard, dans l'immensité du désert.",B2
1061,Cependant nous nous mîmes en marche.,B2
1062,"Quand nous eûmes marché, des heures, en silence, la nuit tomba, et les étoiles commencèrent de s'éclairer.",C2
1063,"Je les apercevais comme en rêve, ayant un peu de fièvre, à cause de ma soif.",B2
1064,Les mots du petit prince dansaient dans ma mémoire.,B1
1065,"- Tu as donc soif, toi aussi ?",A2
1066,Lui demandai-je.,B2
1067,Mais il ne répondit pas à ma question.,A2
1068,"Il me dit simplement :

- L'eau peut aussi être bonne pour le coeur...

je ne compris pas sa réponse mais je me tus... Je savais bien qu'il ne fallait pas l'interroger.",B1
1069,Il était fatigué.,A2
1070,Il s'assit.,A1
1071,Je m'assis auprès de lui.,A2
1072,"Et, après un silence, il dit encore :

- Les étoiles sont belles, à cause d'une fleur que l'on ne voit pas...

Je répondis""bien sûr""et je regardai, sans parler, les plis du sable sous la lune.",B1
1073,"- Le désert est beau, ajouta-t-il.",B2
1074,Et c'était vrai.,A2
1075,J'ai toujours aimé le désert.,A1
1076,On s'assoit sur une dune de sable.,A2
1077,On ne voit rien.,A1
1078,On n'entend rien.,A1
1079,"Et cependant quelque chose rayonne en silence...

- Ce qui embellit le désert, dit le petit prince, c'est qu'il cache un puits quelque part...

Je fus surpris de comprendre soudain ce mystérieux rayonnement du sable.",B1
1080,"Lorsque j'étais petit garçon j'habitais une maison ancienne, et la légende racontait qu'un trésor y était enfoui.",B1
1081,"Bien sûr, jamais personne n'a su le découvrir, ni peut-être même ne l'a cherché.",A2
1082,Mais il enchantait toute cette maison.,A2
1083,"Ma maison cachait un secret au fond de son coeur...

- Oui, dis-je au petit prince, qu'il s'agisse de la maison, des étoiles ou du désert, ce qui fait leur beauté est invisible !",B1
1084,"- Je suis content, dit-il, que tu sois d'accord avec mon renard.",A2
1085,"Comme le petit prince s'endormait, je le pris dans mes bras, et me remis en route.",A2
1086,J'étais ému.,A2
1087,Il me semblait porter un trésor fragile.,B1
1088,Il me semblait même qu'il n'y eût rien de plus fragile sur la Terre.,B1
1089,"Je regardais, à la lumière de la lune, ce front pâle, ces yeux clos, ces mèches de cheveux qui tremblaient au vent, et je me disais :""Ce que je vois là n'est qu'une écorce.",B2
1090,"Le plus important est invisible...""

Comme ses lèvres entr'ouvertes ébauchaient un demisourire je me dis encore :""Ce qui m'émeut si fort de ce petit prince endormi, c'est sa fidélité pour une fleur, c'est l'image d'une rose qui rayonne en lui comme la flamme d'une lampe, même quand il dort...""Et je le devinai plus fragile encore.",C2
1091,Il faut bien protéger les lampes : un coup de vent peut les éteindre...,B1
1092,"Et, marchant ainsi, je découvris le puits au lever du jour.",B2
1093,Alors il s'agitent et tournent en rond...,A2
1094,"Et il ajouta :

- Ce n'est pas la peine...",A2
1095,Le puits que nous avions atteint ne ressemblait pas aux puits sahariens.,B2
1096,Les puits sahariens sont de simples trous creusés dans le sable.,B2
1097,Celui-là ressemblait à un puits de village.,B1
1098,"Mais il n'y avait là aucun village, et je croyais rêver.",B1
