,sentence,difficulty
1099,"- C'est étrange, dis-je au petit prince, tout est prêt la poulie, le seau et la corde...

Il rit, toucha la corde, fit jouer la poulie.",A2
1100,"Et la poulie gémit comme gémit une vieille girouette quand le vent a longtemps dormi,

- Tu entends, dit le petit prince, nous réveillons ce puits et il chante...

Je ne voulais pas qu'il fît un effort

- Laisse-moi faire, lui dis-je, c'est trop lourd pour toi.",B2
1101,Lentement je hissai le seau jusqu'à la margelle.,C2
1102,Je l'y installai bien d'aplomb.,B1
1103,"Dans mes oreilles durait le chant de la poulie et, dans l'eau qui tremblait encore, je voyais trembler le soleil.",C2
1104,"- J'ai soif de cette eau-là, dit le petit prince, donne moi à boire...",A2
1105,"Et je compris ce qu'il avait cherché

Je soulevai le seau jusqu'à ses lèvres.",B1
1106,"Il but, les yeux fermés.",B1
1107,C'était doux comme une fête.,A2
1108,Cette eau était bien autre chose qu'un aliment.,B1
1109,"Elle était née de la marche sous les étoiles, du chant de la poulie, de l'effort de mes bras.",C2
1110,"Elle était bonne pour le coeur, comme un cadeau.",A2
1111,"Lorsque j'étais petit garçon, la lumière de l'arbre de Noël, la musique de la messe de minuit, la douceur des sourires faisaient ainsi tout le rayonnement du cadeau de Noël que je recevais.",B1
1112,"- Les hommes de chez toi, dit le petit prince, cultivent cinq mille roses dans un même jardin... et ils n'y trouvent pas ce qu'ils cherchent...

- Ils ne le trouvent pas, répondis-je...

- Et cependant ce qu'ils cherchent pourrait être trouvé dans une seule rose ou un peu d'eau...

- Bien sûr, répondis-je.",B1
1113,"Et le petit prince ajouta :

- Mais les yeux sont aveugles.",B1
1114,Il faut chercher avec le coeur.,A2
1115,J'avais bu.,A2
1116,Je respirais bien.,A2
1117,"Le sable, au lever du jour, est couleur de miel.",A2
1118,J'étais heureux aussi de cette couleur de miel.,A2
1119,"Pourquoi fallait-il que j'eusse de la peine...

- Il faut que tu tiennes ta promesse, me dit doucement le petit prince, qui, de nouveau, s'était assis auprès de moi.",B1
1120,- Quelle promesse?,A2
1121,- Tu sais... une muselière pour mon mouton... je suis responsable de cette fleur !,A2
1122,Je sortis de ma poche mes ébauches de dessin.,B2
1123,"Le petit prince les aperçut et dit en riant :

- Tes baobabs, ils ressemblent un peu à des choux...

- Oh!",B1
1124,Moi qui étais si fier des baobabs !,B1
1125,"- Ton renard... ses oreilles... elles ressemblent un peu à des cornes... et elles sont trop longues

Et il rit encore.",A2
1126,"- Tu es injuste, petit bonhomme, je ne savais rien
dessiner que les boas fermés et les  boas ouverts.",B1
1127,- Oh !,A2
1128,"ça ira, dit-il, les enfants savent.",A2
1129,Je crayonnai donc une muselière.,B2
1130,"Et j'eus le coeur serré en la lui donnant :

- Tu as des projets que j'ignore...

Mais il ne me répondit pas.",B1
1131,"Il me dit

- Tu sais, ma chute sur la Terre... c'en sera demain l'anniversaire...

Puis, après un silence, il dit encore

- J'étais tombé tout près d'ici...",A2
1132,Et il rougit.,B1
1133,"Et de nouveau, sans comprendre pourquoi, j'éprouvai un chagrin bizarre.",B2
1134,"Cependant une question me vint :

- Alors ce n'est pas par hasard que, le matin où je t'ai connu, il y a huit jours, tu te promenais comme ça, tout seul, à mille milles de toutes les régions habitées ?",B1
1135,Tu retournais vers le point de ta chute ?,A2
1136,Le petit prince rougit encore.,A2
1137,"Et j'ajoutai, en hésitant :

- À cause, peut-être, de l'anniversaire ?...",B1
1138,Le petit prince rougit de nouveau.,A2
1139,"Il ne répondait jamais aux questions, mais, quand on rougit, ça signifie""oui"", n'est-ce pas ?",B1
1140,- Ah !,A1
1141,"lui dis-je, j'ai peur...

Mais il me répondit :

- Tu dois maintenant travailler.",A2
1142,Tu dois repartir vers ta machine.,A2
1143,je t'attends ici.,A1
1144,"Reviens demain soir...

Mais je n'étais pas rassuré.",A2
1145,Je me souvenais du renard.,A2
1146,"Lorsque je revins de mon travail, le lendemain soir, j'aperçus de loin mon petit prince assis là-haut, les jambes pendantes.",B1
1147,"Et je l'entendis qui parlait :

- Tu ne t'en souviens donc pas ?",B1
1148,disait-il.,B1
1149,Ce n'est pas tout à fait ici !,A2
1150,"Une autre voix lui répondit sans doute, puisqu'il répliqua :

- Si !",C1
1151,Si !,A1
1152,"C'est bien le jour, mais ce n'est pas ici l'endroit...

Je poursuivis ma marche vers le mur.",A2
1153,Je ne voyais ni n'entendais toujours personne.,A2
1154,"Pourtant le petit prince répliqua de nouveau :

- ... Bien sûr.",B1
1155,Tu verras où commence ma trace dans le sable.,A2
1156,Tu n'as qu'à m'y attendre.,A2
1157,J'y serai cette nuit.,A1
1158,J'étais à vingt mètres du mur et je ne voyais toujours rien.,A2
1159,"Le petit prince dit encore, après un silence 

- Tu as du bon venin ?",B1
1160,Tu es sûr de ne pas me faire souffrir longtemps ?,A2
1161,"Je fis halte, le coeur serré, mais je ne comprenais toujours pas.",B1
1162,"- Maintenant, va-t'en, dit-il... je veux redescendre !",A2
1163,"Alors j'abaissai moi-même les yeux vers le pied du mur, et je fis un bond !",B2
1164,"Il était là, dressé vers le petit prince, un de ces serpents jaunes qui vous exécutent en trente secondes.",B1
1165,"Tout en fouillant ma poche pour en tirer mon revolver, je pris le pas de course, mais, au bruit que je fis, le serpent se laissa doucement couler dans le sable, comme un jet d'eau qui meurt, et, sans trop se presser, se faufila entre les pierres avec un léger bruit de métal.",B2
1166,"Je parvins au mur juste à temps pour y recevoir dans les bras mon petit bonhomme de prince, pâle comme la neige.",B1
1167,- Quelle est cette histoire-là !,A2
1168,Tu parles maintenant avec les serpents !,A2
1169,J'avais défait son éternel cache-nez d'or.,B2
1170,Je lui avais mouillé les tempes et l'avais fait boire.,B1
1171,Et maintenant je n'osais plus rien lui demander.,A2
1172,Il me regarda gravement et m'entoura le cou de ses bras.,B1
1173,"je sentais battre son coeur comme celui d'un oiseau qui meurt, quand on l'a tiré à la carabine.",B1
1174,"Il me dit :

,- Je suis content que tu aies trouvé ce qui manquait à ta machine.",A2
1175,"Tu vas pouvoir rentrer chez toi...

- Comment sais-tu ?",A2
1176,"Je venais justement lui annoncer que, contre toute espérance, j'avais réussi mon travail !",B1
1177,"Il ne répondit rien à ma question, mais il ajouta

- Moi aussi, aujourd'hui, je rentre chez moi...

Puis, mélancolique :

- C'est bien plus loin... c'est bien plus difficile...

Je sentais bien qu'il se passait quelque chose d'extraordinaire.",A2
1178,"Je le serrais dans les bras comme un petit enfant, et cependant il me semblait qu'il coulait verticalement dans un abîme sans que je pusse rien pour le retenir...

Il avait le regard sérieux, perdu très loin.",B2
1179,- J'ai ton mouton.,A2
1180,Et j'ai la caisse pour le mouton.,A2
1181,Et j'ai la muselière...,A2
1182,Et il sourit avec mélancolie.,B1
1183,J'attendis longtemps.,B1
1184,"Je sentais qu'il se réchauffait peu à peu :

- Petit bonhomme, tu as eu peur...

Il avait eu peur, bien sûr !",B1
1185,"Mais il rit doucement

- J'aurai bien plus peur ce soir...

De nouveau je me sentis glacé par le sentiment de l'irréparable.",B1
1186,Et je compris que je ne supportais pas l'idée de ne plus jamais entendre ce rire.,A2
1187,C'était pour moi comme une fontaine dans le désert.,A2
1188,"- Petit bonhomme, je veux encore t'entendre rire...

Mais il me dit :

- Cette nuit, ça fera un an.",A2
1189,"Mon étoile se trouvera juste au-dessus de l'endroit où je suis tombé l'année dernière...

- Petit bonhomme, n'est-ce pas que c'est un mauvais rêve cette histoire de serpent et de rendez-vous et d'étoile...

Mais il ne répondit pas à ma question.",A2
1190,"Il me dit

- Ce qui est important, ça ne se voit pas...

- Bien sûr...

- C'est comme pour la fleur.",A2
1191,"Si tu aimes une fleur qui se trouve dans une étoile, c'est doux, la nuit, de regarder le ciel.",A2
1192,Toutes les étoiles sont fleuries.,B1
1193,"- Bien sûr...

- C'est comme pour l'eau.",A2
1194,"Celle que tu m'as donnée à boire était comme une musique, à cause de la poulie et de la corde... tu te rappelles... elle était bonne.",A2
1195,"- Bien sûr...

- Tu regarderas, la nuit, les étoiles.",A2
1196,C'est trop petit chez moi pour que je te montre où se trouve la mienne.,A2
1197,C'est mieux comme ça.,A2
1198,"Mon étoile, ça sera pour toi une des étoiles.",A2
1199,"Alors, toutes les étoiles, tu aimeras les regarder... Elles seront toutes tes amies.",A2
1200,"Et puis je vais te faire un cadeau...

Il rit encore.",A2
1201,- Ah!,A1
1202,"Petit bonhomme, petit bonhomme, j'aime entendre ce rire !",A2
1203,"- Justement ce sera mon cadeau... ce sera comme pour l'eau...

- Que veux-tu dire ?",A2
1204,- Les gens ont des étoiles qui ne sont pas les mêmes.,A2
1205,"Pour les uns, qui voyagent, les étoiles sont des guides.",B1
1206,Pour d'autres elles ne sont rien que de petites lumières.,B1
1207,"Pour d'autres, qui sont savants, elles sont des problèmes.",B1
1208,Pour mon businessman elles étaient de l'or.,A2
1209,Mais toutes ces étoiles-là se taisent.,B1
1210,"Toi, tu auras des étoiles comme personne n'en a...

- Que veux-tu dire ?",A2
1211,"- Quand tu regarderas le ciel, la nuit, puisque j'habiterai dans l'une d'elles, puisque je rirai dans l'une d'elles, alors ce sera pour toi comme si riaient toutes les étoiles.",B1
1212,"Tu auras, toi, des étoiles qui savent rire

Et il rit encore.",B1
1213,- Et quand tu seras consolé (on se console toujours) tu seras content de m'avoir connu.,B1
1214,Tu seras toujours mon ami.,A2
1215,Tu auras envie de rire avec moi.,A2
1216,"Et tu ouvriras parfois ta fenêtre, comme ça, pour le plaisir...",A2
1217,Et tes amis seront bien étonnés de te voir rire en regardant le ciel.,A2
1218,"Alors tu leur diras :""Oui, les étoiles, ça me fait toujours rire !",A2
1219,"""Et ils te croiront fou.",B1
1220,Je t'aurai joué un bien vilain tour...,B2
1221,Et il rit encore.,A2
1222,"- Ce sera comme si je t'avais donné, au lieu d'étoiles, des tas de petits grelots qui savent rire...",A2
1223,Et il rit encore.,A2
1224,"Puis il redevint sérieux

- Cette nuit... tu sais... ne viens pas.",B2
1225,- Je ne te quitterai pas.,A2
1226,- J'aurai l'air d'avoir mal... j'aurai un peu l'air de mourir.,A2
1227,C'est comme ça.,A2
1228,"Ne viens pas voir ça, ce n'est pas la peine.",A1
1229,- Je ne te quitterai pas.,A2
1230,Mais il était soucieux.,B1
1231,- je te dis ça... c'est à cause aussi du serpent.,A2
1232,"Il ne faut pas qu'il te morde... Les serpents, c'est méchant.",A2
1233,"Ça peut mordre pour le plaisir...

- Je ne te quitterai pas.",A2
1234,"Mais quelque chose le rassura

- C'est vrai qu'ils n'ont plus de venin pour la seconde morsure...

Cette nuit-là je ne le vis pas se mettre en route.",B1
1235,Il s'était évadé sans bruit.,B1
1236,"Quand je réussis à le rejoindre il marchait décidé, d'un pas rapide.",B1
1237,"Il me dit seulement :

- Ah !",B1
1238,Tu es là...,A1
1239,Et il me prit par la main.,A2
1240,"Mais il se tourmenta encore:

- Tu as eu tort.",B1
1241,Tu auras de la peine.,A2
1242,"J'aurai l'air d'être mort et ce ne sera pas vrai...

Moi je me taisais.",A2
1243,- Tu comprends.,A1
1244,C'est trop loin.,A1
1245,Je ne peux pas emporter ce corps-là.,A2
1246,C'est trop lourd.,A1
1247,Moi je me taisais.,A2
1248,- Mais ce sera comme une vieille écorce abandonnée.,B1
1249,"Ce n'est pas triste les vieilles écorces...

Moi je me taisais.",B1
1250,Il se découragea un peu.,B2
1251,"Mais il fit encore un effort :

- Ce sera gentil, tu sais.",B1
1252,Moi aussi je regarderai les étoiles.,A1
1253,Toutes les étoiles seront des puits avec une poulie rouillée.,B2
1254,"Toutes les étoiles me verseront à boire...

Moi je me taisais.",B1
1255,- Ce sera tellement amusant !,A2
1256,"Tu auras cinq cents millions de grelots, j'aurai cinq cents millions de fontaines...",C2
1257,"Et il se tut aussi, parce qu'il pleurait...

- C'est là.",A2
1258,Laisse-moi faire un pas tout seul.,A1
1259,Et il s'assit parce qu'il avait peur.,A2
1260,"Il dit encore :

- Tu sais... ma fleur... j'en suis responsable !",A2
1261,Et elle est tellement faible !,A2
1262,Et elle est tellement naïve.,A2
1263,"Elle a quatre épines de rien du tout pour la protéger contre le monde...

Moi je m'assis parce que je ne pouvais plus me tenir debout.",A2
1264,"Il dit :

- Voilà... C'est tout...

Il hésita encore un peu, puis il se releva.",A2
1265,Il fit un pas.,A2
1266,Moi je ne pouvais pas bouger.,A2
1267,Il n'y eut rien qu'un éclair jaune près de sa cheville.,B2
1268,Il demeura un instant immobile.,B2
1269,Il ne cria pas.,A2
1270,Il tomba doucement comme tombe un arbre.,B2
1271,"Ça ne fit même pas de bruit, à cause du sable.",A2
1272,Les camarades qui m'ont revu ont été bien contents de me revoir vivant.,B1
1273,"J'étais triste, mais je leur disais :""C'est la fatigue...""

Maintenant je me suis un peu consolé.",A2
1274,C'est-à-dire... pas tout à fait.,A2
1275,"Mais je sais bien qu'il est revenu à sa planète, car, au lever du jour, je n'ai pas retrouvé son corps.",A2
1276,Ce n'était pas un corps tellement lourd...,A2
1277,Et j'aime la nuit écouter les étoiles.,A1
1278,"C'est comme cinq cents millions de grelots...

Mais voilà qu'il se passe quelque chose d'extraordinaire.",A2
1279,"La muselière que j'ai dessinée pour le petit prince, j'ai oublié d'y ajouter la courroie de cuir !",B1
1280,Il n'aura jamais pu l'attacher au mouton.,A2
1281,"Alors je me demande :""Que s'est-il passé sur sa planète ?",A2
1282,"Peut-être bien que le mouton a mangé la fleur...""

Tantôt je me dis :""Sûrement non !",A2
1283,"Le petit prince enferme sa fleur toutes les nuits sous son globe de verre, et il surveille bien son mouton...""Alors je suis heureux.",B1
1284,Et toutes les étoiles rient doucement.,B1
1285,"Tantôt je me dis :""On est distrait une fois ou l'autre, et ça suffit !",A2
1286,"Il a oublié, un soir, le globe de verre, ou bien le mouton est sorti sans bruit pendant la nuit...""Alors les grelots se changent tous en larmes !",B1
1287,"...

C'est là un bien grand mystère.",B1
1288,"Pour vous qui aimez aussi le petit prince, comme pour moi, rien de l'univers n'est semblable si quelque part, on ne sait où, un mouton que nous ne connaissons pas a, oui ou non, mangé une rose...

Regardez le ciel.",B1
1289,Demandez-vous : Le mouton oui ou non a-t-il mangé la fleur ?,A2
1290,Et vous verrez comme tout change...,A2
1291,Et aucune grande personne ne comprendra jamais que ça a tellement d'importance !,A2
